timestamp,story_id,story_title,output_file,background_file,music_file
2025-03-11 13:16:13,1,,20250311_131157_story_1_.mp4,ai ugc 5.mp4,showreel-music-promo-advertising-opener-vlog-background-intro-theme-261601.mp3
2025-03-11 15:59:06,1,,20250311_155159_story_1_.mp4,5698962-uhd_2160_3840_24fps.mp4,Charlie - Pretending.mp3
2025-03-11 16:37:39,1,I matched my boyfriend's energy in our LDR and now he's mad that I communicate like him 😏,20250311_163146_StoryGen_s1_iMatchedMy_pexels stock negative_instrumental mellow.mp4,6382078-uhd_2160_3840_24fps.mp4,Charlie - Pretending.mp3
2025-03-11 17:47:04,1,"My bf (26M) and I (25F) fight constantly over his lack of communication, so I finally stopped caring...now he's upset that I'm not trying anymore",20250311_173935_s1_myBf26mAndI_pexels stock negative mixed solo_instrumental mellow.mp4,6382082-uhd_2160_3840_24fps.mp4,Charlie - Pretending.mp3
2025-03-11 18:34:43,1,My boyfriend suddenly hates that I matched his energy,20250311_182801_s1_myBoyfriendSuddenlyHatesThat_pexels stock negative mixed solo_instrumental mellow.mp4,7277922-uhd_2160_3840_25fps.mp4,i dont like mirrors - i miss your warm hands.mp3
2025-03-11 19:19:42,1,My LDR boyfriend suddenly hates that I matched his energy,20250311_191510_s1_myLdrBoyfriendSuddenlyHates_pexels stock negative f solo_instrumental mellow.mp4,7214654-hd_720_1280_25fps.mp4,lilacs - slowed.mp3
